Name,Description,Latitude,Longitude,InfoURL,ImageURL
UCSB,A great university located along the California coast!,34.416929,-119.845991,"https://en.wikipedia.org/wiki/University_of_California,_Santa_Barbara",https://web.physics.ucsb.edu/~Women/images/ucsb-big.jpg
Cliffs of Id,"One of my favorite indoor climbing spots, with hundreds of climbs to choose from!",34.033223,-118.371112,https://touchstoneclimbing.com/cliffs-of-id/,https://s3-media0.fl.yelpcdn.com/bphoto/y8-Blat9sk9SLR5CxJ5icw/o.jpg
Six Flags Magic Mountain,"As an adrenaline junkie, this is where I get my thrills!",34.422675,-118.595308,https://en.wikipedia.org/wiki/Six_Flags_Magic_Mountain,https://www.dailynews.com/wp-content/uploads/2021/03/LDN-L-MAGIC-MOUNTAIN-0318-FEATURED-1.jpg?w=1020
Top of the Rock,One of the many cool places I went during my trip to New York. Great views from up here!,40.759048,-73.97939,https://www.topoftherocknyc.com/,https://www.nycgo.com/images/venues/189/top-of-the-rock-opening-day-midtown-manhattan-nyc.jpg
Nintendo Store NY,"I'm a big Nintendo fan, so visiting this huge store was really cool to see!",40.758099,-73.979458,https://en.wikipedia.org/wiki/Nintendo_New_York,https://api.time.com/wp-content/uploads/2016/02/nintendo-store-flagship-nyc86.jpg
West Oval Lake,Possibly the best stop on an awesome three-week outdoor trip I went on.,48.276551,-120.460428,https://www.alltrails.com/trail/us/washington/west-oval-lake-trail,https://cdn-assets.alltrails.com/uploads/photo/image/27504875/extra_large_ab914b6cfeec00ab43ba7946ec661362.jpg